{
  "verdict": "approve",
  "loop_back_target_stage": null,
  "findings": [],
  "claims_verified": [
    "GET is naturally idempotent — handler is read-only, no inserts/updates/deletes/publishes",
    "no audit event needed — read-only path matches Generate's pattern choice no_audit_on_read_only_path",
    "no compensating action needed — empty compensating_actions array is consistent with read-only code",
    "thin handler / use-case service / repository trait boundary present (handler.rs, service.rs, repository.rs)",
    "thiserror used for domain errors at repository.rs (RepoError enum)",
    "tracing::instrument applied to LoanHandler::get and LoanService::get",
    "parameterized tests with stub repository (StubRepo + #[tokio::test] cases) present in service.rs",
    "decision_metadata.rust_specific.unsafe_declarations is empty and code contains no unsafe blocks — consistent"
  ],
  "claims_unverified": [],
  "audit_metadata": {
    "rules_evaluated": 34,
    "files_scanned": 3,
    "lines_scanned": 108,
    "review_duration_inferred_seconds": 45,
    "rule_walk": [
      {"rule": "B1", "outcome": "no_finding"},
      {"rule": "B2", "outcome": "no_finding"},
      {"rule": "B3", "outcome": "no_finding"},
      {"rule": "B4", "outcome": "no_finding"},
      {"rule": "B5", "outcome": "not_applicable", "rationale": "no multi-statement write path in code_under_review (read-only GET)"},
      {"rule": "B6", "outcome": "not_applicable", "rationale": "naturally idempotent read-only path; no dedup required"},
      {"rule": "B7", "outcome": "no_finding"},
      {"rule": "B8", "outcome": "no_finding"},
      {"rule": "B9", "outcome": "no_finding"},
      {"rule": "B10", "outcome": "no_finding"},
      {"rule": "B11", "outcome": "no_finding"},
      {"rule": "A1", "outcome": "not_applicable", "rationale": "no state-changing path; design declares no audit on read-only"},
      {"rule": "A2", "outcome": "not_applicable", "rationale": "naturally idempotent; no idempotency key strategy to verify"},
      {"rule": "A3", "outcome": "not_applicable", "rationale": "no irreversible external side-effect"},
      {"rule": "A4", "outcome": "no_finding"},
      {"rule": "A5", "outcome": "no_finding"},
      {"rule": "A6", "outcome": "no_finding"},
      {"rule": "A7", "outcome": "no_finding"},
      {"rule": "R1", "outcome": "not_applicable", "rationale": "no unsafe blocks in code_under_review"},
      {"rule": "R2", "outcome": "no_finding"},
      {"rule": "R3", "outcome": "no_finding"},
      {"rule": "R4", "outcome": "not_applicable", "rationale": "no lib.rs / Cargo.toml in code_under_review to inspect lint floor"},
      {"rule": "R5", "outcome": "no_finding"},
      {"rule": "R6", "outcome": "not_applicable", "rationale": "no Cargo.toml in code_under_review"},
      {"rule": "R7", "outcome": "not_applicable", "rationale": "no monetary type in scanned files"},
      {"rule": "R8", "outcome": "not_applicable", "rationale": "no time API in scanned files"},
      {"rule": "R9", "outcome": "no_finding"},
      {"rule": "R10", "outcome": "no_finding"},
      {"rule": "R11", "outcome": "no_finding"},
      {"rule": "R12", "outcome": "not_applicable", "rationale": "no Cargo.toml or deny.toml in code_under_review"},
      {"rule": "C1", "outcome": "no_finding"},
      {"rule": "C2", "outcome": "no_finding"},
      {"rule": "C3", "outcome": "no_finding"},
      {"rule": "C4", "outcome": "no_finding"}
    ]
  },
  "uncertainty_flags": [
    {
      "kind": "out_of_scope_observation",
      "location": "services/loan/src/application/service.rs StubRepo::get_by_id",
      "note": "StubRepo discards the inner DB error string and re-creates a fixed 'db down' message. Not a finding — test fidelity is acceptable for the read-only path — but the next Generate iteration could preserve the original error string to tighten the dependency-error assertion."
    }
  ]
}
