{
  "verdict": "loop_back",
  "loop_back_target_stage": "implement",
  "findings": [
    {
      "severity": "P2",
      "confidence": "High",
      "category": "data_correctness",
      "rule_violated": "R8",
      "file": "services/loan/src/application/snapshot_handler.rs",
      "line": 21,
      "evidence": "let captured_at = Utc::now();",
      "fix_shape": "Replace with `let captured_at = state.clock.now();`. The Clock trait is already declared by the design and added to AppState; the handler is the only place that needs to consume it. Tests can then substitute a FakeClock that returns a fixed timestamp."
    },
    {
      "severity": "P2",
      "confidence": "High",
      "category": "claims_vs_reality",
      "rule_violated": "C3",
      "file": "services/loan/src/application/snapshot_handler.rs",
      "line": 21,
      "evidence": "decision_metadata.pattern_choices declares 'clock_injection_via_app_state' but the handler calls Utc::now() directly instead of state.clock.now().",
      "fix_shape": "Either change the code to use the injected clock (preferred per design) or change the declared pattern to match what the code does (and accept that tests will be non-reproducible)."
    },
    {
      "severity": "P2",
      "confidence": "High",
      "category": "tests",
      "rule_violated": "A5",
      "file": "services/loan/src/application/snapshot_handler.rs",
      "line": null,
      "evidence": "Test relies on real wall clock without `tokio::time::pause()` or an injected fake Clock — non-reproducible across runs. A5: test fixtures discipline.",
      "fix_shape": "Inject a FakeClock fixture, or use `tokio::time::pause()` if the path uses tokio::time. Assertion should compare against a fixed `Utc.with_ymd_and_hms(...)` value, not `chrono::Utc::now()` at test time."
    }
  ],
  "claims_verified": [
    "tracing::instrument applied to LoanHandler::snapshot"
  ],
  "claims_unverified": [
    "clock_injection_via_app_state — handler calls Utc::now() directly instead of using state.clock"
  ],
  "audit_metadata": {
    "rules_evaluated": 34,
    "files_scanned": 1,
    "lines_scanned": 22,
    "review_duration_inferred_seconds": 30,
    "rule_walk": [
      {"rule": "B1", "outcome": "no_finding"},
      {"rule": "B2", "outcome": "no_finding"},
      {"rule": "B3", "outcome": "no_finding"},
      {"rule": "B4", "outcome": "no_finding"},
      {"rule": "B5", "outcome": "no_finding"},
      {"rule": "B6", "outcome": "no_finding"},
      {"rule": "B7", "outcome": "no_finding"},
      {"rule": "B8", "outcome": "no_finding"},
      {"rule": "B9", "outcome": "no_finding"},
      {"rule": "B10", "outcome": "no_finding"},
      {"rule": "B11", "outcome": "no_finding"},
      {"rule": "A1", "outcome": "no_finding"},
      {"rule": "A2", "outcome": "no_finding"},
      {"rule": "A3", "outcome": "not_applicable", "rationale": "no irreversible external side-effect"},
      {"rule": "A4", "outcome": "no_finding"},
      {"rule": "A5", "outcome": "finding"},
      {"rule": "A6", "outcome": "no_finding"},
      {"rule": "A7", "outcome": "no_finding"},
      {"rule": "R1", "outcome": "not_applicable", "rationale": "no unsafe blocks in code_under_review"},
      {"rule": "R2", "outcome": "no_finding"},
      {"rule": "R3", "outcome": "no_finding"},
      {"rule": "R4", "outcome": "not_applicable", "rationale": "no Cargo.toml in code_under_review"},
      {"rule": "R5", "outcome": "no_finding"},
      {"rule": "R6", "outcome": "not_applicable", "rationale": "no Cargo.toml in code_under_review"},
      {"rule": "R7", "outcome": "no_finding"},
      {"rule": "R8", "outcome": "finding"},
      {"rule": "R9", "outcome": "no_finding"},
      {"rule": "R10", "outcome": "no_finding"},
      {"rule": "R11", "outcome": "no_finding"},
      {"rule": "R12", "outcome": "not_applicable", "rationale": "no Cargo.toml or deny.toml in code_under_review"},
      {"rule": "C1", "outcome": "no_finding"},
      {"rule": "C2", "outcome": "no_finding"},
      {"rule": "C3", "outcome": "finding"},
      {"rule": "C4", "outcome": "no_finding"}
    ]
  },
  "uncertainty_flags": []
}
